Key,Type,Desc,Korean,English,Japanese,Chinese,Chinese-TW [zh-tw]
Buff/B_Muelsyse_01_Description,Text,,"턴 종료시, 패에 있는 자신의 스킬 1장당 체력을 3 회복한다.","At the end of the turn, restore 3 HP for each of your skills in hand.",ターン終了時、手札にある自身のスキル1枚につき体力を3回復する。,回合结束时，手中每一个自己的技能恢复3生命。,回合結束時，手中每一個自己的技能恢復3生命。
Buff/B_Muelsyse_01_Name,Text,,보습,Moisturizing,保湿 ,滋润,滋潤
Buff/B_Muelsyse_01_P_Description,Text,,,,,,
Buff/B_Muelsyse_01_P_Name,Text,,이슬 모으기 : 이슬의 치유,Dew Gathering: Dew's Healing,露集め：露の癒し,集露：露水治愈,集露：露水治愈
Buff/B_Muelsyse_02_Description,Text,,"치명타에 의해 받는 피해가 1이 된다. 
치명타를 받으면 「기본 공격」으로 반격한다.
[유동체]의 경우는 「유체 공격」으로 반격한다. 
치명타를 입으면 1중첩 감소한다.","Critical damage received becomes 1.
Counterattacks with ""Basic Attack"" when receiving Critical damage. If this unit is a [Fluidform], counterattacks with ""Fluidform Attack"".
Loses 1 stack when receiving Critical damage.","クリティカルによって受けるダメージが1になる。 
クリティカルを受けると「基本攻撃」で反撃する。
[うつろう水影]の場合は「流体攻撃」で反撃する。 
クリティカルを受けるとストックが1減少する。 ","受到的暴击伤害变为1。
受到暴击伤害后以基础攻击反击。若自身为流形，以流形攻击反击。
受到暴击伤害后消耗1层。","受到的暴擊傷害變為1。
受到暴擊傷害後以基礎攻擊反擊。若自身為流形，以流形攻擊反擊。
受到暴擊傷害後消耗1層。"
Buff/B_Muelsyse_02_Name,Text,,부드러움과 강인함의 조화,Softness Overcomes Hardness,柔よく剛を制す,以柔克刚,
Buff/B_Muelsyse_02_P_Description,Text,,「유체 치유」와 「유체 보호」는 대상에게 [부드러움과 강인함의 조화]를 1중첩 부여한다. ,"""Fluidform Healing"" and ""Fluidform Protection"" grant 1 stack of [Softness Overcomes Hardness] to the target.",「流体治癒」と「流体保護」は、対象に[柔よく剛を制す]を1ストック与える。 ,流形治疗和流形保护对目标施加1层“以柔克刚”,流形治療和流形保護對目標施加1層「以柔克剛」
Buff/B_Muelsyse_02_P_Name,Text,,이슬 모으기 : 부드러움과 강인함의 조화,Dew Gathering: Softness Overcomes Hardness,露集め：柔よく剛を制す,集露：以柔克刚,集露：以柔克剛
Buff/B_Muelsyse_03_Description,Text,,공격을 받으면 체력을 5 초과치유한다. ,Overheal 5 HP when attacked.,攻撃を受けると体力を5オーバーヒールする。 ,受到攻击后超额恢复5生命。,受到攻擊後超額恢復5生命。
Buff/B_Muelsyse_03_Name,Text,,물의 파동,Rippling Waves,水の波動,涌动水流,湧動水流
Buff/B_Muelsyse_03_P_Name,Text,,이슬 모으기 : 물의 파동,Dew Gathering: Rippling Waves,露集め：水の波動,集露：涌动水流,集露：湧動水流
Buff/B_Muelsyse_04_Description,Text,,"공격으로 피해를 입혔을 경우, 입힌 피해의 20%만큼 자신을 회복한다. ",Heal self for 20% of damage dealt when attacking.,攻撃によってダメージを与えた場合、与えたダメージの20%で自身を回復する。 ,攻击造成伤害时治疗自身伤害量20%的生命。,攻擊造成傷害時治療自身傷害量20%的生命。
Buff/B_Muelsyse_04_Name,Text,,심도 잠수,Deep Dive,深度潜水,深度汲取,深度汲取
Buff/B_Muelsyse_04_P_Description,Text,,"[유동체]가 공격으로 피해를 입히면 입힌 피해의 20%만큼 자신을 초과치유하고, 입힌 피해의 20%만큼 자신을 연쇄치유한다.",When a [Fluidform] deals damage via attack: Overheal self by 20% of the damage and Chain Heal self by 20% of the damage.,[うつろう水影]が攻撃でダメージを与えると、与えたダメージの20%で自身をオーバーヒールし、与えたダメージの20%で自身を連鎖治癒する。,流形通过攻击造成伤害时，超额治疗自身相当于伤害量20%的生命，并连锁治疗自身相当于伤害量20%的生命。,流形通過攻擊造成傷害時，超額治療自身相當於傷害量20%的生命，並連鎖治療自身相當於傷害量20%的生命。
Buff/B_Muelsyse_04_P_Name,Text,,이슬 모으기 : 심도잠수,Dew Gathering: Deep Dive,露集め：深度潜水,集露：深度汲取,集露：深度汲取
Buff/B_Muelsyse_05_Description,Text,,무색이 아닌 디버프를 받았을 때 빈사 상태가 아니면 10의 고통 피해를 입고 그 디버프를 제거한다.,When receiving a non-colorless debuff: Take 10 Pain damage (if not at Death's Door) and remove that debuff.,無色でないデバフを受けたとき、瀕死状態でなければ、10の苦痛ダメージを受け、そのデバフを除去する。 ,受到非无色减益时，如果未处于濒死状态，受到10点痛苦伤害抵挡该减益，然后解除。,受到非無色減益時，如果未處於瀕死狀態，受到10點痛苦傷害抵擋該減益，然後解除。
Buff/B_Muelsyse_05_Name,Text,,정수 의존,Purified Water Dependency,浄水依存,净水依存,凈水依存
Buff/B_Muelsyse_05_P_Description,Text,,"턴 종료 시 체력을 잃지 않고, 최대 체력의 10%만큼의 초과치유를 받지만, 자신이 디버프를 받을 때마다 15의 피해를 입는다. ","At turn end: No longer loses HP naturally and gains Overheal equal to 10% of Max HP, but takes 15 damage per debuff received.",ターン終了時に体力が失われることがなくなり、最大体力の10%のオーバーヒールを受けるが、自分にデバフが与えられる度15のダメージを受ける。 ,回合结束时不再自然流失生命，且会超额恢复生命上限10%的生命，但每被施加一层减益时会立即受到15点痛苦伤害。,回合結束時不再自然流失生命，且會超額恢復生命上限10%的生命，但每被施加一層減益時會立即受到15點痛苦傷害。
Buff/B_Muelsyse_05_P_Name,Text,,이슬 모으기 : 청정수는 생명,"Dew Gathering: ""Pure Water is Life""",露集め：清き水、即ち命なり,集露：净水即生命,集露：凈水即生命
Buff/B_Muelsyse_06_Description,Text,,[유동체]를 가지고 있으면 효과가 강화된다.,Effects are enhanced if a [Fluidform] is present.,[うつろう水影]を持つなら効果が強化される。,流形存在时效果增强。,流形存在時效果增強。
Buff/B_Muelsyse_06_Name,Text,,침식,Erosion,浸食,侵蚀,侵蝕
Buff/B_Muelsyse_06_P_Description,Text,,[유동체]의 공격 스킬은 도발을 무시한다. [유동체]가 공격으로 피해를 입히면 [침식]을 1중첩 부여한다. ,[Fluidform] attack skills ignore Taunt. Applying 1 stack of [Erosion] when a [Fluidform] deals attack damage.,[うつろう水影]の攻撃スキルは挑発を無視する。[うつろう水影]が攻撃によってダメージを与えると[浸食]を1ストック与える。 ,流形的敌人指向技能无视嘲讽；流形通过攻击造成伤害时施加1层“侵蚀”。,流形的敵人指向技能無視嘲諷；流形通過攻擊造成傷害時施加1層「侵蝕」。
Buff/B_Muelsyse_06_P_Name,Text,,이슬 모으기 : 유수 침식,Dew Gathering: Fluidform Erosion,露集め：流水浸食,集露：侵蚀水流,集露：侵蝕水流
Buff/B_Muelsyse_07_Description,Text,,"턴이 종료될 때 자신의 스킬이 패에 있다면, 덱에서 자신의 다른 스킬 1장을 뽑는다. ","At turn end: If your skill is in hand, draw another skill of yours from the deck.",ターン終了時に、自身のスキルが手札にある場合は、デッキから自身の別のスキルを1枚引く。 ,回合结束时若手中有自己的技能，再从牌库抽取一个自己的技能。,回合結束時若手中有自己的技能，再從牌庫抽取一個自己的技能。
Buff/B_Muelsyse_07_Name,Text,,고속 성장,Rapid Growth,高速成長,极速生长,
Buff/B_Muelsyse_07_P_Name,Text,,이슬 모으기 : 빠른 성장,Dew Gathering: Rapid Growth,露集め：高速成長,集露：极速生长,極速生長
Buff/B_Muelsyse_08_P_Description,Text,,"[유동체]의 기본 공격력은 대상의 치유력이 된다.
[유동체]의 기본 치유력은 대상의 공격력이 된다.","[Fluidform]'s base Attack becomes equal to the target's Healing power.
[Fluidform]'s base Healing becomes equal to the target's Attack power.","[うつろう水影]の基本攻撃力は、対象の治癒力になる。
[うつろう水影]の基本治癒力は、対象の攻撃力になる。","流形的基础攻击力按目标的治疗力生成
流形的基础治疗力按目标的攻击力生成","流形的基礎攻擊力按目標的治療力生成
流形的基礎治療力按目標的攻擊力生成"
Buff/B_Muelsyse_08_P_Name,Text,,이슬 모으기 : 이물불쟁,Dew Gathering: Fluidformity Without Conflict,露集め：利物不争,集露：利物不争,集露：利物不爭
Buff/B_Muelsyse_09_0_Name,Text,,고통 저항 증가,Pain Resistance Up,苦痛レジスト増加,痛苦抗性提升,痛苦抗性提升
Buff/B_Muelsyse_09_1_Name,Text,,약화 저항 증가,Weakness Resistance Up,衰弱レジスト増加,弱化抗性提升,弱化抗性提升
Buff/B_Muelsyse_09_2_Name,Text,,방해 저항 증가,Disruption Resistance Up,干渉レジスト増加,干扰抗性提升,幹擾抗性提升
Buff/B_Muelsyse_09_P_Description,Text,,"[유동체]가 디버프를 받을 때마다 아군 전체가 3턴 동안 해당 종류의 디버프 저항이 15% 증가한다.
이 [유동체]가 사라진 후, 다시 [유동체]를 소환하기 위한 쿨타임을 감소시킨다. ","Whenever a [Fluidform] receives a debuff: All allies gain 15% resistance to that debuff type for 3 turns.
Reduces cooldown for resummoning [Fluidform] after it dissipates.","[うつろう水影]がデバフを受けるたび、味方全体は対応する種類のデバフのレジストが3ターンの間15%増加する。
この[うつろう水影]が消滅した後、再び[うつろう水影]を召喚するためのクールダウンを減少させる。 ","每当流形被成功施加减益后，使所有友军对应类型减益的抵抗率在三回合内提升15%。
此流形消散后，再次召唤流形的冷却时间减少。","每當流形被成功施加減益後，使所有友軍對應類型減益的抵抗率在三回合內提升15%。
此流形消散後，再次召喚流形的冷卻時間減少。"
Buff/B_Muelsyse_09_P_Name,Text,,이슬 모으기 : 표면적 비엔트로피 적응,Dew Gathering: Surface Non-Entropic Adaptation,"露集め： ノンエントロピー適応
",集露：浅层非熵适应,集露：淺層非熵適應
Buff/B_Muelsyse_10_P_Description,Text,,패에서 유체 스킬을 사용하면 무작위 적에게 [유동체]의 공격력의 40%만큼의 추적 피해를 준다. 적을 처치할 때마다 「유체 공격」 1개를 생성한다. ,"Using Fluidform skills from hand deals 40% of [Fluidform]'s Attack as Follow-up damage to random enemies. Generates 1 ""Fluidform Attack"" whenever an enemy is defeated.",手札から流体スキルを使用すると、ランダムな敵に[うつろう水影]の攻撃力の40%で追撃ダメージを与える。敵を倒すたびに「流体攻撃」を1枚生成する。 ,集露：使用手中流形的技能时对随机敌人造成40%流形攻击力的追击伤害。每当有敌人倒下时在手中生成一张流形攻击。,集露：使用手中流形的技能時對隨機敵人造成40%流形攻擊力的追擊傷害。每當有敵人倒下時在手中生成一張流形攻擊。
Buff/B_Muelsyse_10_P_Name,Text,,이슬 모으기 : 생태학적 상호작용,Dew Gathering: Ecological Coupling,露集め： 生態系統結合 ,集露：生态耦合,集露：生態耦合
Buff/B_Muelsyse_11_2_Name,Text,,유체 보호 - 회복 게이지 보호,Fluidform Protection - Healing Gauge Protection,流体保護-回復ゲージ保護,流形保护-体力极限,流形保護-體力極限
Buff/B_Muelsyse_P_ColdDown_Description,Text,,"일시적으로 [유동체]를 소환할 수 없다. 
패에서 스킬을 사용할 때마다 1중첩 감소한다. (소멸한 [유동체]가 가지고 있던 [이슬 모으기]의 개수가 많을수록 이 디버프의 초기 중첩수가 많아진다.) ","Temporarily cannot summon [Fluidform].
Lose 1 stack per skill used from hand.
(Initial stacks scale with the number of [Dew Gathering] effects the dissipated [Fluidform] had)","一時的に[うつろう水影]を呼び出せない。 
手札からスキルを使用するたびに、ストックを1減少させる。 (消滅した[うつろう水影]が持っていた[露集め]の数が多いほど、このデバフの初期ストック数は高くなる) ","暂时无法召唤流形。
每从手中使用一个任意技能，减少一层。
（方才消散的流形拥有的集露增益越多，此减益的初始层数越高）","暫時無法召喚流形。
每從手中使用一個任意技能，減少一層。
（方才消散的流形擁有的集露增益越多，此減益的初始層數越高）"
Buff/B_Muelsyse_P_ColdDown_Name,Text,,유동체 냉각 중......,Fluidform Cooldown...,うつろう水影冷却中……,流形冷却中……,流形冷卻中……
Buff/B_Muelsyse_P_Description,Text,,"[유동체]로 존재한다.
회복 게이지를 가지지 않으며 체력이 0이 되면 소멸한다.
매 턴 종료 시 최대 체력의 30%를 잃는다.","Exists as a [Fluidform].
Has no Healing Gauge and dissipates at 0 HP.
Loses 30% of Max HP at turn end.","[うつろう水影]として存在する。
回復ゲージを持つことはなく体力が0になると消滅する。
毎ターン終了時に最大体力の30%が失われる。","以流形形式存在。
没有体力极限；生命值低于0时消散。
每回合结束时自然流失30%生命上限的生命。","以流形形式存在。
沒有體力極限；生命值低於0時消散。
每回合結束時自然流失30%生命上限的生命。"
Buff/B_Muelsyse_P_Name,Text,,유동체,Fluidform,うつろう水影,流形,流形
Buff/B_Muelsyse_R2_Description,Text,,이 효과는 디버프가 없을 때 얻을 수 있다.,This effect can only be obtained when free of debuffs.,この効果は、デバフを持たない場合に得られる。,没有任何减益时，才能获得效果。,沒有任何減益時，才能獲得效果。
Buff/B_Muelsyse_R2_Name,Text,,청정 무결,Pristine Purity,清浄無垢,纯净无瑕,純凈無瑕
Buff/B_Muelsyse_R2_P_Description,Text,,"「유체 치유」는 대상의 무작위 디버프 1개를 제거한다.
[유동체] 소멸 시, 다른 아군 전체에 [청정 무결]을 부여한다. ","""Fluidform Healing"" removes 1 random debuff from target.
Grants [Pristine Purity] to all other allies when a [Fluidform] dissipates.","「流体治癒」は対象からランダムなデバフを1つ除去する。
[うつろう水影]の消滅時、他の味方全員に[清浄無垢]を与える ","流形治疗可以解除目标的一个随机减益。
流形消散时为所有其他友军施加“纯净无瑕”","流形治療可以解除目標的一個隨機減益。
流形消散時為所有其他友軍施加「純凈無瑕」"
Buff/B_Muelsyse_R2_P_Name,Text,,이슬 모으기 : 심연 순수,Dew Gathering: Abyssal Purity,露集め： 深淵純粋,集露：深层纯净,集露：深層純凈
Buff/B_Muelsyse_R3_P_Description,Text,,"[유동체]의 복사본의 대상이 피해를 입었을 때, 그 피해를 1로 하고, 턴 종료 시 [유동체]는 체력을 10 추가로 잃는다(이는 중첩된다). 
[유동체]의 복사본의 대상이 생성된 스킬이 아닌 스킬을 사용할 때, 그 스킬의 복사본을 패에 추가한다. 이 스킬은 0코스트에 제외, 신속, 1턴 후 버림이 부여되고, 피해량/치유량이 80% 감소된 유체 스킬이 된다.","When [Fluidform] copy's target takes damage: Reduce that damage to 1, but the [Fluidform] loses 10 HP at turn end (stacks). 
Using non-generated skills with copy's target adds a copied skill to hand: 0 Mana cost, Exclude, Swiftness, discard after 1 turn, 80% reduced damage/healing as Fluidform skill.","[うつろう水影]のコピーの対象がダメージを受けたとき、そのダメージを1にするが、ターン終了時に[うつろう水影]は体力を10追加で失う（これは重複する）。 
[うつろう水影]のコピーの対象が生成でないスキルを使用すると、そのスキルのコピーを手札に加える。これはコスト0で除外、迅速と1ターン後に捨てられるを持ち、ダメージ/治癒量が80％減少した流体スキルとなる。","流形的复制目标受到伤害时，使该伤害变化为1，但当回合结束时流形额外流失10生命（会叠加）。
流形的复制目标使用非生成技能后，将该技能的一张复制加入手牌，该技能为流形的技能，附带放逐、迅速，费用为0，1回合后弃牌，伤害和治疗倍率减少80%。","流形的復製目標受到傷害時，使該傷害變化為1，但當回合結束時流形額外流失10生命（會疊加）。
流形的復製目標使用非生成技能後，將該技能的一張復製加入手牌，該技能為流形的技能，附帶放逐、迅速，費用為0，1回合後棄牌，傷害和治療倍率減少80%。"
Buff/B_Muelsyse_R3_P_Name,Text,,이슬 모으기 : 전속 대역,Dew Gathering: Designated Proxy,露集め：専属代役,集露：专属替身,集露：專屬替身
Buff/B_Muelsyse_R3_T_Description,Text,,"피해를 받으면 그 피해를 1로 하고, 턴 종료 시 [유동체]가 잃는 체력이 증가한다. 
생성되지 않은 자신의 스킬을 사용하면 해당 스킬의 복사본을 패에 추가한다. 이는 0코스트에 제외, 신속, 피해/치유량이 80% 감소된 유체 스킬이 된다.","Incoming damage becomes 1, but increases HP loss for [Fluidform] at turn end. 
Using non-generated skills adds their copies to hand: 0 Mana cost, Exclude, Swiftness, 80% reduced damage/healing as Fluidform skill.","ダメージを受けたとき、そのダメージを1にするが、ターン終了時に[うつろう水影]が失う体力が増加する。 
生成されていない自身のスキルを使用すると、そのスキルのコピーを手札に加える。これはコスト0で除外、迅速を持ち、ダメージ/治癒量が80％減少した流体スキルとなる。","受到的伤害变化为1，但是会使流形回合结束时流失的生命增加。
自身使用手中的非生成技能后，将该技能的一张复制加入手牌，该技能为流形的技能，附带放逐、迅速，费用为0，1回合后弃牌，伤害和治疗倍率减少80%。","受到的傷害變化為1，但是會使流形回合結束時流失的生命增加。
自身使用手中的非生成技能後，將該技能的一張復製加入手牌，該技能為流形的技能，附帶放逐、迅速，費用為0，1回合後棄牌，傷害和治療倍率減少80%。"
Buff/B_Muelsyse_R3_T_Name,Text,,자신의 대리인 ,Personal Proxy,自身の代役 ,拥有专属替身,擁有專屬替身
Buff/B_Muelsyse_R4_Description,Text,,"이 버프는 [유동체] 사용 시 일시적으로 제거된다.
자신의 일회성 또는 제외를 가진 스킬이 사용으로 인해 제외되었을 때, 패, 덱, 버린 카드에 있는 자신의 스킬이 모두 일회성 또는 제외를 가지고 있다면 아군 전원의 체력을 회복한다. 자신의 스킬을 우선적으로 1장 드로우한다(1턴에 1장&b).  
자신의 패, 덱, 버린 카드에 자신의 스킬이 없다면, 소모품 '뮤엘시스의 눈물'을 획득하고 이 버프를 제거한다.","This buff is temporarily removed when using [Fluidform]. 
When your single-use/Exclude skills get Excluded: If all your skills in hand/deck/discard are single-use/Exclude-type, heal all allies &a HP and prioritize drawing 1 of your skills (1/turn &b). If you have no skills remaining: Gain consumable ""Muelsyse's Tear"" and remove this buff.","このバフは、[うつろう水影]使用時に一時的に取り除かれる。
自身の単発や除外を持つスキルが使用によって除外されたとき、手札、デッキ、捨て札にある自身のスキルがすべて単発か除外を持つなら、味方全員の体力を&a回復する。 自身のスキルを優先して１枚引く(1ターン1枚&b)。  
手札、デッキ、捨て札に自身のスキルがないなら、消耗品「ミュルジスの涙」を得てこのバフを除去する。","此增益在转换为流形时只会暂时解除。
主动使用自己的一次性和放逐的技能时，若手中、牌库中和弃牌库中自己的所有技能都是一次性或放逐技能，治疗所有友军&a生命，并优先抽取1个自己的技能（每回合限1张，&b）。如果此时手中、牌库中和弃牌库中已经没有自己的技能，获得消耗品“缪尔赛思之泪”并解除此增益。","此增益在轉換為流形時只會暫時解除。
主動使用自己的一次性和放逐的技能時，若手中、牌庫中和棄牌庫中自己的所有技能都是一次性或放逐技能，治療所有友軍&a生命，並優先抽取1個自己的技能（每回合限1張，&b）。如果此時手中、牌庫中和棄牌庫中已經沒有自己的技能，獲得消耗品「繆爾賽思之淚」並解除此增益。"
Buff/B_Muelsyse_R4_Name,Text,,이국의 고독 ,Solitude in a Foreign Land,異国の孤独 ,孑然异乡,孑然異鄉
Buff/B_Muelsyse_Relic_Description,Text,,,,,,
Buff/B_Muelsyse_Relic_Name,Text,,호박색 흉터,Amber Scar,琥珀の傷跡,琥珀伤痕,琥珀傷痕
Buff/B_Muelsyse_S2_Description,Text,,"[유동체]의 방어력에 따라 받는 피해량이 감소(최대 35%) 
[유동체]가 사라지면 제거됨.","Damage received is reduced by [Fluidform]'s Defense (up to 35%). 
Removed when [Fluidform] dissipates.","受けるダメージは[うつろう水影]の防御力によって軽減される(最大35%) 
[うつろう水影]が消滅すると除去される。 ","受到伤害减少，减少量为流形的防御力（至多为35%）
流形消散时解除。","受到傷害減少，減少量為流形的防禦力（至多為35%）
流形消散時解除。"
Buff/B_Muelsyse_S2_Name,Text,,유체 보호,Fluidform Protection,流体保護,流形保护,流形保護
Buff/B_Muelsyse_S2_T_Description,Text,,치유력 기반,Barrier value scales with [Fluidform]'s Healing power.,治癒力ベース,保护罩的数值基于流形的治疗力,保護罩的數值基於流形的治療力
Buff/B_Muelsyse_S2_T_Name,Text,,보호막,Barrier,バリア,保护罩,保護罩
