Key,Type,Desc,Korean,English,Japanese,Chinese,Chinese-TW [zh-tw]
Character/Muelsyse_PassiveDes,Text,,"고정 스킬을 사용하여 [유동체]를 소환하여 자신을 대신해 싸우게 한다.
[유동체]를 소환하면 지정된 아군의 현재 능력치를 자신의 기본 능력치로 복사한다(방어력과 회피율은 최대 30%까지 복사 가능하다).
[유동체] 소환 중, 뮤엘시스의 스킬은 일시적으로 전투에서 제외되고 유체 전용 스킬이 덱에 추가된다.
[유동체] 소환 중, 뮤엘시스의 장비는 일시적으로 사용할 수 없으며, 뮤엘시스가 원래 가지고 있던 버프와 디버프도 제거됩니다. 
[유동체]는 턴 종료 시 체력을 잃는다. [유동체]의 체력이 0 이하가 되면 소멸하여 뮤엘시스로 돌아가고, 해당 턴에는 [유동체]를 소환할 수 없게 된다. 
소멸한 [유동체]가 가진 [이슬 모으기]가 많을수록 재소환까지 걸리는 턴 수가 증가한다.","Uses fixed skills to summon [Fluidform] to fight in her stead. 
Copies a designated ally’s current stats as base stats when summoning [Fluidform] (Defense/Evasion capped at 30%). 
During [Fluidform] summoning, Muelsyse’s skills are temporarily Excluded and Fluidform-exclusive skills are added to deck. 
Equipment becomes unusable, and original buffs/debuffs are removed. [Fluidform] loses HP at turn end. 
Dissipates at 0 HP, reverting to Muelsyse with temporary summon lock. 
Cooldown scales with [Dew Gathering] stacks on dissipated [Fluidform].      ","固定スキルを使用して[うつろう水影]を召喚し、自分に代わって戦わせる。
[うつろう水影]を召喚すると、指定された味方の現在の能力値を自身の基本能力値としてコピーする (防御力と回避率は最大30%)。
 [うつろう水影]召喚中、ミュルジスのスキルは一時的に戦闘から除外され、流体専用スキルがデッキに加えられる。
 [うつろう水影]召喚中、ミュルジスの装備は一時的に使用できなくなり、ミュルジスが元々持つバフとデバフも除去される。 
 [うつろう水影]はターン終了時に体力を失う。 [うつろう水影]の体力が0以下になると、消滅してミュルジスに戻り、そのターン中は[うつろう水影]を召喚できなくなる。 
消滅した[うつろう水影]の持つ[霧集め]が多いほど再召喚までのターン数が増加する","可以使用固定能力召唤流形代替自己作战：
流形出现时复制指定友军的当前属性作为自身的基础属性（防御力和闪避率至多复制30%）；
流形作战期间缪尔赛思的技能被暂时移出战斗，但是牌库中会出现特殊的流形技能；
流形作战期间缪尔赛思的装备会暂时不可用，且缪尔赛思原本的增益和减益也会消失。
流形在回合结束时自然流失生命。
流形生命值低于0时消散，切换回缪尔赛思本体作战，且暂时不可切换流形作战。
方才消散的流形所拥有的“集露”增益越多，切换流形的冷却时间越长。","可以使用固定能力召喚流形代替自己作戰：
流形出現時復製指定友軍的當前屬性作為自身的基礎屬性（防禦力和閃避率至多復製30%）；
流形作戰期間繆爾賽思的技能被暫時移出戰鬥，但是牌庫中會出現特殊的流形技能；
流形作戰期間繆爾賽思的裝備會暫時不可用，且繆爾賽思原本的增益和減益也會消失。
流形在回合結束時自然流失生命。
流形生命值低於0時消散，切換回繆爾賽思本體作戰，且暫時不可切換流形作戰。
方才消散的流形所擁有的「集露」增益越多，切換流形的冷卻時間越長。"
Character/Muelsyse_PassiveName,Text,,유동체,Fluidform,うつろう水影 ,召唤流形,召喚流形
Character/Muelsyse_SelectInfo,Text,,"뮤엘시스는 라인 생명생태과 주임이며 클루비아 생명과학 및 환경과학 전문가이다.  물의 예술을 이용해 다양한 생물이 그녀를 대신해 싸운다. 

고정 스킬을 사용해 다양한 유동체를 소환해 자신을 대신해 싸울 수 있기 때문에 매우 유연한 지원 캐릭터다. 

<i><color=#87c241> ""나는 라인 랩 생태과 주임 뮤엘시스야. 그래도 우리 사이에 그런 격식 차린 인사는 필요 없겠지? 박사, 그것도 그럴 게 이미 우린 친구잖아."" </color></i> ","Muelsyse is Rhine Lab’s Ecological Section Chief and a Cluviel life/environmental science expert. 

Uses water arts to command organisms in battle. A flexible support character who summons [Fluidform] variants via fixed skills.

<i><color=#87c241>""I’m Muelsyse, Rhine Lab Ecological Section Chief. But let’s skip formalities – we’re already friends, Doctor.""</color></i>","ミュルジスはライン生命生態課の主任であり、クルビア生命科学及び環境科学の専門家である。  水のアーツを用いさまざまな生物が彼女の代わりに戦う。 

固定スキルを使用してさまざまな水影を召喚し、自分の代わりに戦せることができるため、非常に柔軟なサポート キャラクターである。 
","莱茵生命生态科主任缪尔赛思，擅长使用水分身：流形代替自己作战。

缪尔赛思可以使用固定能力召唤流形协助友军作战，是非常灵活的支援型角色。","萊茵生命生態科主任繆爾賽思，擅長使用水分身：流形代替自己作戰。

繆爾賽思可以使用固定能力召喚流形協助友軍作戰，是非常靈活的支援型角色。"
Character/Muelsyse_name,Text,,뮤엘시스,Muelsyse,ミュルジス ,缪尔赛思,繆爾賽思
Item_Consume/Item_Muelsyse_Consume_Description,Text,,대상을 15 초과치유하고 무색이 아닌 모든 디버프를 제거한다.,Overheal target by 15 HP and remove all non-colorless debuffs.,対象を15オーバーヒールし、無色でないすべてのデバフを除去する。,超额治疗目标15生命，强制解除目标的所有非无色减益。,超額治療目標15生命，強製解除目標的所有非無色減益。
Item_Consume/Item_Muelsyse_Consume_name,Text,,뮤엘시스의 눈물,Muelsyse's Tear,ミュルジスの涙,缪尔赛思之泪,繆爾賽思之淚
Item_Equip/Item_Muelsyse_Equip_Description,Text,,"턴 시작 시 마나 1을 얻는다. 
이 장비의 모든 효과는 전투의 첫 턴에만 유효하다.
<color=#919191>""나는 생명과 희망을 가져와."" </color> ","Gain 1 Mana at turn start. 
All effects only active during first combat turn.

<color=#919191>""I bring life and hope.""</color>","ターン開始時にマナを1得る。 
この装備のすべての効果は、戦闘の最初のターンのみ有効。
<color=#919191>私は命と希望をもたらします。</color> ","回合开始时获得1法力值
此装备的所有效果仅在战斗的第一回合生效

<color=#919191>“我带来了生命和希望。”</color>","回合開始時獲得1法力值
此裝備的所有效果僅在戰鬥的第一回合生效

<color=#919191>「我帶來了生命和希望。」</color>"
Item_Equip/Item_Muelsyse_Equip_name,Text,,보온병,Thermos,魔法瓶,热水壶,熱水壺
Item_Passive/Item_Muelsyse_Relic_Description,Text,,"턴 시작 시 아군 전체가 디버프를 가지고 있지 않은 경우, 스킬을 1장 뽑고 이 턴 동안 아군 전체의 공격력과 회복력이 8% 증가한다. 그렇지 않은 경우, 무작위 아군에게서 무작위 디버프 1개를 제거한다.
<color=#919191>엘프들은 테라 땅에 남겨져 먼지를 뒤집어쓰고 이국땅에 등을 돌렸다. </color>","At turn start: If all allies are debuff-free, draw 1 skill and boost allies’ ATK/Healing by 8% this turn. Otherwise, remove 1 random debuff from random ally.
<color=#919191>Elves remain on Terra’s soil, bearing dust while turning from foreign lands.</color>","ターン開始時に味方全員がデバフを持っていない場合、スキルを1枚引き、このターン中味方全員の攻撃力と回復力が8%増加する。そうでない場合、ランダムな味方からランダムなデバフを1つ除去する。
<color=#919191>エルフたちはテラの地に取り残され、塵を抱え、異国の地に背を向ける。 </color> ","回合开始时，如果所有友军没有任何减益，额外抽取1个技能，且所有友军本回合内攻击力、治疗力+8%；否则解除随机友军的一个随机减益。
<color=#919191>精灵们如此孤独地遗留在泰拉的大地上，怀抱尘土，背靠异乡。</color>","回合開始時，如果所有友軍沒有任何減益，額外抽取1個技能，且所有友軍本回合內攻擊力、治療力+8%；否則解除隨機友軍的一個隨機減益。
<color=#919191>精靈們如此孤獨地遺留在泰拉的大地上，懷抱塵土，背靠異鄉。</color>"
Item_Passive/Item_Muelsyse_Relic_name,Text,,호박색 흉터,Amber Scar,琥珀の傷跡,琥珀伤痕,琥珀傷痕
Skill/S_Muelsyse_01_Description,Text,,"<color=#87ab6d>이슬 모으기 : 「유체 치유」 2장을 패에 추가, [유동체]의 치유력 +2</color>.","<color=#87ab6d>Dew Gathering: Add 2 ""Fluidform Healing"" to hand; [Fluidform] Healing +2</color>",<color=#87ab6d>露集め：「流体治癒」を2枚手札に加える；[うつろう水影]の治癒力+2。</color>,<color=#87ab6d>集露：将2张流形治疗置入手中；流形的治疗力+2。</color>,<color=#87ab6d>集露：將2張流形治療置入手中；流形的治療力+2。</color>
Skill/S_Muelsyse_01_Name,Text,,이슬의 치유,Dew’s Healing,露の癒し,露水治愈,露水治愈
Skill/S_Muelsyse_02_Description,Text,,<color=#87ab6d>이슬 모으기 : [유동체]는 [부드러움과 강인함의 조화]를 3중첩 획득. 「유체 치유」와 「유체 보호」는 대상에게 [부드러움과 강인함의 조화]를 1중첩 부여합니다. </color>,"<color=#87ab6d>Dew Gathering: [Fluidform] gains 3 stacks of [Softness Overcomes Hardness]. ""Fluidform Healing/Protection"" grants 1 stack to target</color>",<color=#87ab6d>露集め：[うつろう水影]は[柔よく剛を制す]を3ストック得る。「流体治癒」と「流体保護」は対象に[柔よく剛を制す]を1ストック与える。</color>,<color=#87ab6d>集露：流形获得3层“以柔克刚”。流形治疗和流形保护对目标施加1层“以柔克刚”。</color>,<color=#87ab6d>集露：流形獲得3層「以柔克剛」。流形治療和流形保護對目標施加1層「以柔克剛」。</color>
Skill/S_Muelsyse_02_Name,Text,,부드러움과 강인함의 조화,Softness Overcomes Hardness,柔よく剛を制す,以柔克刚,以柔克刚
Skill/S_Muelsyse_03_Description,Text,,"대상은 모든 적을 도발한다. 
<color=#87ab6d>이슬 모으기 : 「유체 보호」 1장을 패에 추가하고, [유동체]의 최대 체력 +10, [유동체]를 소환하면 모든 적을 도발하고 [물의 파동]을 얻는다. </color>","Taunt all enemies.
<color=#87ab6d>Dew Gathering: Add 1 ""Fluidform Protection"" to hand; [Fluidform] Max HP +10. Summoning [Fluidform] taunts enemies and grants [Rippling Waves]</color>","対象はすべての敵を挑発する。 
<color=#87ab6d>露集め：「流体保護」を1枚手札に加える；[うつろう水影]の最大体力+10。[うつろう水影]を召喚すると、すべての敵を挑発し、[水の波動]を得る。</color> ","目标嘲讽所有敌人。
<color=#87ab6d>集露：将1张流形保护置入手中；流形的生命上限+10。流形出现时嘲讽所有敌人，并获得“涌动水流”。</color>","目標嘲諷所有敵人。
<color=#87ab6d>集露：將1張流形保護置入手中；流形的生命上限+10。流形出現時嘲諷所有敵人，並獲得「湧動水流」。</color>"
Skill/S_Muelsyse_03_Name,Text,,물의 파동,Rippling Waves,水の波動,涌动水流,湧動水流
Skill/S_Muelsyse_04_Description,Text,,"<color=#87ab6d>이슬 모으기 : [유동체]의 공격력 +2 ; [유동체]가 공격으로 피해를 입히면, 입힌 피해의 20%만큼 자신을 초과 치유하고, 입힌 피해의 20%만큼 자신을 연쇄 치유합니다. </color> ",<color=#87ab6d>Dew Gathering: [Fluidform] ATK +2; Attacks Overheal self by 20% damage and Chain Heal 20% damage</color>,<color=#87ab6d>露集め：[うつろう水影]の攻撃力+2；「流体攻撃」を1枚手札に加える；[うつろう水影]が攻撃でダメージを与えると、与えたダメージの20%で自身をオーバーヒールし、与えたダメージの20%で自身を連鎖治癒する。</color> ,<color=#87ab6d>集露：流形攻击力+2；将1张流形攻击置入手中；流形的攻击会以伤害量的20%超额治疗自身，并以伤害量的20%进行连锁治疗。</color>,<color=#87ab6d>集露：流形攻擊力+2；將1張流形攻擊置入手中；流形的攻擊會以傷害量的20%超額治療自身，並以傷害量的20%進行連鎖治療。</color>
Skill/S_Muelsyse_04_Name,Text,,심도 잠수,Deep Dive,深度潜水,深度汲取,深度汲取
Skill/S_Muelsyse_05_Description,Text,,"아군 전체의 회복 게이지 보호.
<color=#87ab6d>이슬 모으기 : 「유체 치유」 1장을 패에 추가, [유동체]의 최대 체력 +20, 치유력 +3, 턴이 끝날 때 체력 손실이 없어지고 소량의 초과 치유를 받지만, 자신에게 디버프가 걸릴 때마다 15의 피해를 입는다. </color>","Restore all allies’ Healing Gauge.
<color=#87ab6d>Dew Gathering: Add 1 ""Fluidform Healing""; [Fluidform] Max HP +20/Healing +3. No natural HP loss + minor Overheal at turn end, but take 15 damage per debuff received</color>","味方全員の回復ゲージ保護。
<color=#87ab6d>露集め：「流体治癒」を1枚手札に加える；[うつろう水影]の最大体力+20，治癒力+3，ターン終了時に体力が失われることがなくなり、少量のオーバーヒールを受けるが、自分にデバフが与えられる度15のダメージを受ける。</color> ","恢复所有友军的体力极限。
<color=#87ab6d>集露：将1张流形治疗置入手中；流形的生命上限+20，治疗力+3，回合结束时不再自然流失生命，且会超额恢复少量生命，但每被施加一层减益时会立即受到15点痛苦伤害。</color>","恢復所有友軍的體力極限。
<color=#87ab6d>集露：將1張流形治療置入手中；流形的生命上限+20，治療力+3，回合結束時不再自然流失生命，且會超額恢復少量生命，但每被施加一層減益時會立即受到15點痛苦傷害。</color>"
Skill/S_Muelsyse_05_Name,Text,,청정수는 생명,"""Pure Water is Life""",清き水、即ち命なり,净水即生命,凈水即生命
Skill/S_Muelsyse_06_Description,Text,,<color=#87ab6d>이슬 모으기 : 「유체 공격」 1장을 패에 추가한다. [유동체]의 공격 스킬은 도발을 무시한다. [유동체]가 공격으로 피해를 입히면 [침식]을 1중첩 부여한다. </color> ,"<color=#87ab6d>Dew Gathering: Add 1 ""Fluidform Attack"". [Fluidform] attack skills ignore Taunt. Apply 1 [Erosion] stack per attack damage</color>",<color=#87ab6d>露集め：「流体攻撃」を1枚手札に加える。；[うつろう水影]の攻撃スキルは挑発を無視する。[うつろう水影]が攻撃によってダメージを与えると[浸食]を1ストック与える。 </color> ,<color=#87ab6d>集露：将一张流形攻击置入手中。流形的敌人指向技能无视嘲讽；流形通过攻击造成伤害时施加1层“侵蚀”。</color>,<color=#87ab6d>集露：將一張流形攻擊置入手中。流形的敵人指向技能無視嘲諷；流形通過攻擊造成傷害時施加1層「侵蝕」。</color>
Skill/S_Muelsyse_06_Name,Text,,유수 침식,Fluidform Erosion,流水浸食,侵蚀水流,侵蝕水流
Skill/S_Muelsyse_07_Description,Text,,"<color=#87ab6d>이슬 모으기 : [유동체]를 소환할 때 모든 마나를 소모하고, 소모한 마나 1당 무작위 유체 전용 스킬 1개를 패에 추가합니다. [유동체]의 최대 체력 +5, 공격력 +1, 치유력 +1. 덱에 추가되는 유체 스킬의 수가 두 배 증가합니다. </color>",<color=#87ab6d>Dew Gathering: Consume all Mana when summoning [Fluidform] (1 Mana = 1 random Fluidform skill). [Fluidform] Max HP +5/ATK +1/Healing +1. Double Fluidform skills added to deck</color>,<color=#87ab6d>露集め：[うつろう水影]を召喚時にすべてのマナを消費して、消費したマナ1につきランダムな流体専用スキルを手札に加える。[うつろう水影]の最大体力+5，攻撃力+1，治癒力+1。デッキに加えられる流体スキルの数が倍になる。</color> ,<color=#87ab6d>集露：流形出现时消耗所有剩余法力值，每消耗1点，将1张随机流形技能置入手中，并使流形的最大生命值+5，攻击力+1，治疗力+1。加入牌库的流形技能数量翻倍。</color>,<color=#87ab6d>集露：流形出現時消耗所有剩余法力值，每消耗1點，將1張隨機流形技能置入手中，並使流形的最大生命值+5，攻擊力+1，治療力+1。加入牌庫的流形技能數量翻倍。</color>
Skill/S_Muelsyse_07_Name,Text,,고속 성장,Rapid Growth,高速成長,极速生长,極速生長
Skill/S_Muelsyse_08_Description,Text,,"패에 공격 스킬이 없을 때만 사용 가능. 덱에서 비공격 스킬 3장을 뽑는다. 
<color=#87ab6d>이슬 모으기: 「유체 치유」 1장을 패에 추가한다. [유동체] 소환 시 [유동체]의 기본 공격력은 대상의 치유력이 된다. [유동체]의 기본 치유력은 대상의 공격력이 된다. </color>","Usable only with no attack skills in hand. Draw 3 non-attack skills.
<color=#87ab6d>Dew Gathering: [Fluidform]’s base ATK = target’s Healing; base Healing = target’s ATK. Add 1 ""Fluidform Healing""</color>","手札に攻撃スキルが無い場合のみ使用可能。デッキから非攻撃スキルを3枚引く。 
<color=#87ab6d>露集め：「流体治癒」を1枚手札に加える。[うつろう水影]召喚時に[うつろう水影]の基本攻撃力は、対象の治癒力になる。[うつろう水影]の基本治癒力は、対象の攻撃力になる。</color> ","仅当手中没有任何攻击技能时可以使用。从牌库抽取3个非攻击技能。
<color=#87ab6d>集露：流形生成时，基础攻击力按目标的治疗力生成，基础治疗力按目标的攻击力生成。将1张流形治疗置入手中。</color>","僅當手中沒有任何攻擊技能時可以使用。從牌庫抽取3個非攻擊技能。
<color=#87ab6d>集露：流形生成時，基礎攻擊力按目標的治療力生成，基礎治療力按目標的攻擊力生成。將1張流形治療置入手中。</color>"
Skill/S_Muelsyse_08_Name,Text,,이물불쟁,Fluidformity Without Conflict,利物不争,利物不争,利物不爭
Skill/S_Muelsyse_09_Description,Text,,"아군 전체가 가지고 있는 디버프 지속시간을 2턴 감소. 
[유동체]의 소환 재사용 대기시간 감소 제거
<color=#87ab6d>이슬 모으기 : [유동체]가 디버프를 받을 때마다 아군 전체가 3턴 동안 해당 종류의 디버프에 대한 저항이 15% 증가합니다. 이 [유동체]가 사라진 후, 다시 [유동체]를 소환하기 위한 재사용 대기시간이 감소한다. </color>","Reduce all allies’ debuff duration by 2 turns. 
Remove [Fluidform] summon cooldown.
<color=#87ab6d>Dew Gathering: Allies gain 15% resistance to debuff type for 3 turns per [Fluidform] debuff. Reduces resummon cooldown post-dissipation</color>","味方全員の持つデバフの持続時間を2ターン短縮。 
[うつろう水影]の召喚クールダウンを除去する
<color=#87ab6d>露集め：[うつろう水影]がデバフを受けるたび、味方全体は対応する種類のデバフのレジストが3ターンの間15%増加する。この[うつろう水影]が消滅した後、再び[うつろう水影]を召喚するためのクールダウンを減少させる。 </color> ","所有友军的减益持续回合-2。
解除召唤流形的冷却状态。
<color=#87ab6d>集露：将1张流形治疗置入手中；每当流形被成功施加减益后，使所有友军对应类型减益的抵抗率在三回合内提升15%。
此流形消散后，再次召唤流形的冷却时间减少。</color>","所有友軍的減益持續回合-2。
解除召喚流形的冷卻狀態。
<color=#87ab6d>集露：將1張流形治療置入手中；每當流形被成功施加減益後，使所有友軍對應類型減益的抵抗率在三回合內提升15%。
此流形消散後，再次召喚流形的冷卻時間減少。</color>"
Skill/S_Muelsyse_09_Name,Text,,표면적 비엔트로피 적응,Surface Non-Entropic Adaptation,ノンエントロピー適応,浅层非熵适应,淺層非熵適應
Skill/S_Muelsyse_10_0_Description,Text,,,,,,
Skill/S_Muelsyse_10_0_Name,Text,,,,,,
Skill/S_Muelsyse_10_Description,Text,,"패에 있는 자신의 다른 스킬은 다음과 같은 효과를 얻는다 : 사용 후 패에 복사본을 생성하고, 생성된 스킬은 제외와 1턴 후 버려짐 효과를 가진다. 
<color=#87ab6d>이슬 모으기 : 패에서 유체 스킬을 사용하면, 무작위 적에게 [유동체] 공격력의 40%만큼의 추격 피해를 준다. 적을 처치할 때마다 「유체 공격」 1개를 생성한다. </color>","Other skills gain: On use, create Excluded copy (discarded after 1 turn).
<color=#87ab6d>Dew Gathering: Fluidform skills deal 40% ATK Follow-up damage. Generate 1 ""Fluidform Attack"" per enemy defeated</color>","手札にある他のすべての自身のスキルは次の効果を得る: 使用後、コピーを手札に生成し、生成されたスキルは除外と、1 ターン後に捨てられるを持つ。 
<color=#87ab6d>露集め：手札から流体スキルを使用すると、ランダムな敵に[うつろう水影]の攻撃力の40%で追撃ダメージを与える。敵を倒すたびに「流体攻撃」を1枚生成する 。</color> ","手中的其他所有自己的技能获得如下效果：使用后将一张复制放入手中；复制的技能获得放逐、1回合后弃牌、迅速。
<color=#87ab6d>集露：使用手中流形的技能时对随机敌人造成40%流形攻击力的追击伤害。每当有敌人倒下时在手中生成一张流形攻击。</color>","手中的其他所有自己的技能獲得如下效果：使用後將一張復製放入手中；復製的技能獲得放逐、1回合後棄牌、迅速。
<color=#87ab6d>集露：使用手中流形的技能時對隨機敵人造成40%流形攻擊力的追擊傷害。每當有敵人倒下時在手中生成一張流形攻擊。</color>"
Skill/S_Muelsyse_10_Name,Text,,생태학적 상호작용,Ecological Coupling,生態系統結合 ,生态耦合,生態耦合
Skill/S_Muelsyse_11_Description,Text,,"이 스킬은 드로우 시 즉시 발동한다. 
스킬 1장을 뽑고, 패의 무작위 스킬 3장에 <color=#87ab6d>[윤화]</color>를 부여한다.
<color=#87ab6d>[윤화]</color> : 대미지 +3, 회복량 +3. 사용 시, 스킬 소유자를 1 초과 치유하고 인접한 스킬에 <color=#87ab6d>[윤화]</color>를 부여한다.
턴 종료 시, 패의 다른 스킬에 <color=#87ab6d>[윤화]</color>를 부여한다. 
<color=#87ab6d>[윤화]</color>는 스킬에 추가 효과를 부여한다.","Activates immediately when drawn. 
Draw 1 skill, apply <color=#87ab6d>[Moisturize]</color> to 3 random skills: +3 damage/healing. 
On use: Overheal owner by 1 and spread [Moisturize]. Apply to other skills at turn end.","このスキルは引いたときに即座に発動する。 
スキルを1枚引き、手札のランダムなスキル3つに<color=#87ab6d>[潤化]</color>を与える。
<color=#87ab6d>[潤化]</color>:ダメージ+3、回復量+3。使用すると、スキルの所有者を1オーバーヒールし、隣接するスキルに<color=#87ab6d>[潤化]</color>を与える。
ターン終了時、手札の他のスキルに<color=#87ab6d>[潤化]</color>を与える。 
<color=#87ab6d>[潤化]</color>はスキルに追加効果を与える。 ","抽取到此技能时立即释放。
抽取一个技能，为手中随机3个技能附加<color=#87ab6d>“润化”</color>。
<color=#87ab6d>润化</color>：伤害、治疗量+3；使用时超额恢复技能的拥有者1点生命，并为相邻的技能附加<color=#87ab6d>“润化”</color>。回合结束时对手中其他技能附加<color=#87ab6d>“润化”</color>。<color=#87ab6d>“润化”</color>对流形技能有额外的效果。","抽取到此技能時立即釋放。
抽取一個技能，為手中隨機3個技能附加<color=#87ab6d>「潤化」</color>。
<color=#87ab6d>潤化</color>：傷害、治療量+3；使用時超額恢復技能的擁有者1點生命，並為相鄰的技能附加<color=#87ab6d>「潤化」</color>。回合結束時對手中其他技能附加<color=#87ab6d>「潤化」</color>。<color=#87ab6d>「潤化」</color>對流形技能有額外的效果。"
Skill/S_Muelsyse_11_Name,Text,,점진적습윤화,Progressive Moisturization,段階的湿潤化,渐进性润化,漸進性潤化
Skill/S_Muelsyse_Consume_Description,Text,,대상을 15 초과 치유하고 무색이 아닌 모든 디버프를 제거한다.,Overheal target by 15 HP and remove all non-colorless debuffs.,対象を15オーバーヒールし、無色でないすべてのデバフを除去する。,超额治疗目标15生命，强制解除目标的所有非无色减益,超額治療目標15生命，強製解除目標的所有非無色減益
